{
  "$schema": "./_schema/entity.v1.schema.json",
  "entity": {
    "id": "CONV",
    "title": "Conventions"
  },
  "rule_set": {
    "version": "0.1.4",
    "timestamp": "2026-10-19T19:22:35Z",
    "hash": "blake3:0e842e9003719a8b25b3cbe9cd2630f6814a8025f6e1aae5e7abb219e66dbb5f"
  },
  "rules": [
    {
      "id": "CONV-001",
      "revision": 0,
      "state": "D",
      "body": "MUST use Conventional Commits format for all commits (type(scope): description). Types: feat, fix, docs, style, refactor, perf, test, build, ci, chore, revert.",
      "added_by": "@pleberre",
      "added_at": "2026-03-25",
      "supersedes": null
    },
    {
      "id": "CONV-002",
      "revision": 0,
      "state": "D",
      "body": "MUST format all Go source files with gofumpt before committing.",
      "added_by": "@pleberre",
      "added_at": "2026-03-25",
      "supersedes": null
    },
    {
      "id": "CONV-003",
      "revision": 0,
      "state": "D",
      "body": "MUST pass golangci-lint v2 with the linters configured in .golangci.yml (errcheck, gocritic, govet, ineffassign, staticcheck).",
      "added_by": "@pleberre",
      "added_at": "2026-10-19",
      "supersedes": null
    },
    {
      "id": "CONV-004",
      "revision": 0,
      "state": "D",
      "body": "MUST wrap an underlying error with %w when returning it so callers can inspect the cause with errors.Is and errors.As.",
      "added_by": "@pleberre",
      "added_at": "2026-10-19",
      "supersedes": null
    }
  ],
  "notes": []
}
