{
  "$schema": "./_schema/entity.v1.schema.json",
  "entity": {
    "id": "CMD",
    "title": "Commands"
  },
  "rule_set": {
    "version": "0.4.0",
    "timestamp": "2026-10-19T19:22:35Z",
    "hash": "blake3:04208cd8a4101ebd8de2e66bdd0946fe780befd46bfc3eca18e55e52ce8e95fe"
  },
  "rules": [
    {
      "id": "CMD-001",
      "revision": 0,
      "state": "P",
      "body": "Every command MUST declare both Short and Long descriptions in its cobra.Command definition.",
      "added_by": "@pleberre",
      "added_at": "2026-03-25",
      "supersedes": null
    },
    {
      "id": "CMD-002",
      "revision": 0,
      "state": "P",
      "body": "Commands that return errors MUST set SilenceUsage: true and SilenceErrors: true to suppress cobra's default error printing.",
      "added_by": "@pleberre",
      "added_at": "2026-03-25",
      "supersedes": null
    },
    {
      "id": "CMD-003",
      "revision": 0,
      "state": "P",
      "body": "Command output MUST be written via cmd.OutOrStdout() and cmd.ErrOrStderr() to support testing with captured output buffers.",
      "added_by": "@pleberre",
      "added_at": "2026-03-25",
      "supersedes": null
    },
    {
      "id": "CMD-004",
      "revision": 0,
      "state": "D",
      "body": "MUST NOT call os.Exit outside the root command's error handler; a command returns an error and the exit code derives from it.",
      "added_by": "@pleberre",
      "added_at": "2026-10-19",
      "supersedes": null
    },
    {
      "id": "CMD-005",
      "revision": 0,
      "state": "D",
      "body": "Long descriptions SHOULD include at least one usage example invoking the command.",
      "added_by": "@pleberre",
      "added_at": "2026-10-19",
      "supersedes": null
    }
  ],
  "notes": []
}
